repositorio,modulo,conceito
Sophia Carolina da Luz,modulo 1,Ainda nao esta pronto
Maria Jessica Ferreira,modulo 1,Chegando la
Caua Renato Campos,modulo 1,Pronto
Tereza Carolina Alessandra Souza,modulo 2,Pronto
Paulo Ian Bryan Carvalho,modulo 2,Ainda nao esta pronto
Manoel Giovanni Manoel Nascimento,modulo 2,Mais que Pronto
Eduarda Simone Daiane Silveira,modulo 2,Pronto
Bernardo Nelson Rafael Jesus,modulo 3,Ainda nao esta pronto
Marlene Vera Jaqueline Lima,modulo 3,Chegando la
Larissa Aparecida Moura,modulo 3,Mais que Pronto
Claudio Ruan Carlos Eduardo Nogueira,modulo 3,Pronto
Alana Leticia Marlene da Costa,modulo 4,Ainda nao esta pronto
Cristiane Rafaela Fernandes,modulo 4,Pronto
Clara Giovana Debora Assuncao,modulo 4,Chegando la
Bianca Ayla Agatha da Rosa,modulo 4,Mais que Pronto
Caleb Erick Kevin Baptista,modulo 5,Ainda nao esta pronto
Giovana Manuela Marli Peixoto,modulo 5,Pronto
Carolina Catarina Viana,modulo 5,Pronto
Silvana Daniela Ester dos Santos,modulo 5,Mais que Pronto
Regina Elisa da Cunha,,